{
    "key": "esp32-devkitc-v4",
    "kind": "board",
    "revision": 1,
    "status": "draft",
    "source": "authored",
    "platform": {
        "name": "ESP32-DevKitC-V4",
        "description": "The reference ESP32 development board. Xtensa dual core with Wi-Fi and classic Bluetooth on an ESP32-WROOM-32E module.",
        "board_type": "Microcontroller",
        "manufacturer": "Espressif",
        "model_number": "ESP32-DevKitC-V4",
        "datasheet_url": "https://docs.espressif.com/projects/esp-idf/en/latest/esp32/hw-reference/esp32/get-started-devkitc.html",
        "cpu": "Xtensa dual-core LX6 @ 240MHz",
        "ram": "520KB SRAM",
        "storage": "4MB Flash",
        "operating_voltage": "3.3V",
        "gpio_pins": 34,
        "pwm_channels": 16,
        "adc_channels": 18,
        "dac_channels": 2,
        "dimensions_mm": null,
        "weight_g": null,
        "has_npu": false,
        "has_gpu": false,
        "has_tpu": false,
        "operating_systems": [
            {
                "name": "ESP-IDF"
            },
            {
                "name": "Arduino Core"
            },
            {
                "name": "MicroPython"
            }
        ],
        "communication_chips": [
            {
                "chip_model": "ESP32-D0WD-V3",
                "protocol": "Wi-Fi",
                "standard": "802.11b/g/n"
            },
            {
                "chip_model": "ESP32-D0WD-V3",
                "protocol": "Bluetooth",
                "standard": "4.2 BR/EDR and BLE"
            }
        ],
        "serial_protocols": [
            {
                "protocol": "I2C",
                "count": 2
            },
            {
                "protocol": "SPI",
                "count": 4
            },
            {
                "protocol": "UART",
                "count": 3
            },
            {
                "protocol": "I2S",
                "count": 2
            },
            {
                "protocol": "CAN",
                "count": 1
            }
        ],
        "interfaces": [
            {
                "type": "Micro USB",
                "count": 1
            },
            {
                "type": "2.54mm header",
                "count": 2
            }
        ],
        "power": [
            {
                "source": "USB",
                "voltage_min": 5,
                "voltage_max": 5
            },
            {
                "source": "5V pin",
                "voltage_min": 5,
                "voltage_max": 5
            },
            {
                "source": "3V3 pin",
                "voltage_min": 3.3,
                "voltage_max": 3.3
            }
        ]
    },
    "harness": {
        "provisioning_model": "micropython",
        "supported_provisioning_models": [
            "micropython",
            "arduino-sketch",
            "vendor-firmware"
        ],
        "component_attachment": "gpio-header",
        "flash": {
            "method": "usb-serial",
            "tool": "esptool.py",
            "port_hint": "/dev/ttyUSB0",
            "baud": 460800,
            "notes": "Flashes through an on-board USB to UART bridge. esptool drives the reset and boot lines automatically, so the boot button is not normally needed."
        },
        "transport": {
            "network": [
                "wifi",
                "bluetooth"
            ],
            "mqtt_client": "umqtt.simple",
            "tls": true,
            "ota": true,
            "notes": "Connects to the broker directly over Wi-Fi. TLS works but the handshake is the largest memory spike in a typical device program, so size the heap around it rather than around steady state."
        },
        "runtime": {
            "os_family": null,
            "python3": true,
            "package_manager": "mip",
            "service_manager": null
        },
        "gpio": {
            "library": "machine",
            "pin_scheme": "gpio",
            "notes": "Almost every pin is routable to almost any peripheral through the GPIO matrix, so a driver binds to a pin number chosen at deploy time rather than to a fixed function. The strapping pins and the pins bonded to on-package flash are the exceptions and must not be used."
        },
        "probe": {
            "model_file": null,
            "overlay_file": null,
            "commands": [
                "import sys; print(sys.implementation)",
                "import os; print(os.uname())",
                "import machine; print(machine.freq())",
                "import gc; gc.collect(); print(gc.mem_free())",
                "from machine import I2C, Pin; print(I2C(0).scan())"
            ]
        },
        "local_inference": {
            "viable": true,
            "accelerator": null,
            "usable_memory_gb": null,
            "llm": {
                "viable": false,
                "max_params_b": null,
                "max_model_size_gb": null,
                "quantisation": [],
                "runtimes": [],
                "notes": "Kilobytes of RAM. A general language model does not run here and never will. Send the reading to something that can."
            },
            "tinyml": {
                "viable": true,
                "frameworks": [
                    "ESP-DL",
                    "TensorFlow Lite Micro",
                    "Edge Impulse"
                ],
                "notes": "ESP-DL is tuned for this core. Wake word and simple classification are realistic; anything involving images is not, without external PSRAM."
            },
            "notes": "The two DACs make this the only ESP32 variant here that can output an analogue waveform without extra hardware."
        },
        "toolchains": [
            "MicroPython",
            "ESP-IDF",
            "Arduino IDE",
            "Arduino CLI",
            "PlatformIO"
        ],
        "verified": {
            "by": null,
            "date": null,
            "os": null,
            "reviewed_by": null,
            "evidence_url": null
        }
    }
}
