{
    "key": "lilygo-t-display-s3",
    "kind": "board",
    "revision": 1,
    "status": "draft",
    "source": "authored",
    "platform": {
        "name": "LilyGO T-Display-S3",
        "description": "ESP32-S3 with a 1.9 inch 170x320 colour LCD, USB-C and a battery connector, in a board narrow enough for a handheld enclosure.",
        "board_type": "Microcontroller",
        "manufacturer": "LilyGO",
        "model_number": "T-Display-S3",
        "datasheet_url": "https://github.com/Xinyuan-LilyGO/T-Display-S3",
        "cpu": "Xtensa dual-core LX7 @ 240MHz",
        "ram": "512KB SRAM plus 8MB PSRAM",
        "storage": "16MB Flash",
        "operating_voltage": "3.3V",
        "gpio_pins": 16,
        "pwm_channels": 8,
        "adc_channels": 6,
        "dac_channels": 0,
        "dimensions_mm": null,
        "weight_g": null,
        "has_npu": false,
        "has_gpu": false,
        "has_tpu": false,
        "operating_systems": [
            {
                "name": "Arduino Core"
            },
            {
                "name": "ESP-IDF"
            },
            {
                "name": "MicroPython"
            }
        ],
        "communication_chips": [
            {
                "chip_model": "ESP32-S3",
                "protocol": "Wi-Fi",
                "standard": "802.11b/g/n"
            },
            {
                "chip_model": "ESP32-S3",
                "protocol": "Bluetooth",
                "standard": "5.0 LE"
            }
        ],
        "serial_protocols": [
            {
                "protocol": "I2C",
                "count": 1
            },
            {
                "protocol": "SPI",
                "count": 2
            },
            {
                "protocol": "UART",
                "count": 2
            }
        ],
        "interfaces": [
            {
                "type": "USB-C",
                "count": 1
            },
            {
                "type": "ST7789 LCD 170x320",
                "count": 1
            },
            {
                "type": "JST battery",
                "count": 1
            },
            {
                "type": "2.54mm header",
                "count": 2
            }
        ],
        "power": [
            {
                "source": "USB",
                "voltage_min": 5,
                "voltage_max": 5
            },
            {
                "source": "5V pin",
                "voltage_min": 5,
                "voltage_max": 5
            },
            {
                "source": "3V3 pin",
                "voltage_min": 3.3,
                "voltage_max": 3.3
            }
        ]
    },
    "harness": {
        "provisioning_model": "arduino-sketch",
        "supported_provisioning_models": [
            "arduino-sketch",
            "micropython",
            "vendor-firmware"
        ],
        "component_attachment": "gpio-header",
        "flash": {
            "method": "usb-native",
            "tool": "esptool.py",
            "port_hint": "/dev/ttyACM0",
            "baud": 921600,
            "notes": "The SoC exposes USB Serial/JTAG directly, so no bridge chip is involved. A firmware that reconfigures those pins loses the port until the board is put back into download mode by holding BOOT while tapping RESET."
        },
        "transport": {
            "network": [
                "wifi",
                "bluetooth"
            ],
            "mqtt_client": "umqtt.simple",
            "tls": true,
            "ota": true,
            "notes": "Connects to the broker directly over Wi-Fi. TLS works but the handshake is the largest memory spike in a typical device program, so size the heap around it rather than around steady state."
        },
        "runtime": {
            "os_family": null,
            "python3": false,
            "package_manager": null,
            "service_manager": null
        },
        "gpio": {
            "library": null,
            "pin_scheme": "gpio",
            "notes": "Almost every pin is routable to almost any peripheral through the GPIO matrix, so a driver binds to a pin number chosen at deploy time rather than to a fixed function. The strapping pins and the pins bonded to on-package flash are the exceptions and must not be used."
        },
        "probe": {
            "model_file": null,
            "overlay_file": null,
            "commands": [
                "arduino-cli board list",
                "arduino-cli board details --fqbn <fqbn>"
            ]
        },
        "local_inference": {
            "viable": true,
            "accelerator": "dsp",
            "usable_memory_gb": null,
            "llm": {
                "viable": false,
                "max_params_b": null,
                "max_model_size_gb": null,
                "quantisation": [],
                "runtimes": [],
                "notes": "Kilobytes of RAM. A general language model does not run here and never will. Send the reading to something that can."
            },
            "tinyml": {
                "viable": true,
                "frameworks": [
                    "ESP-DL",
                    "TensorFlow Lite Micro"
                ],
                "notes": "S3 silicon with 8MB PSRAM, so the same models the DevKitC-1 handles."
            },
            "notes": "The display is driven over a parallel 8080 bus, not SPI, which rules out most generic ST7789 drivers. Use the vendor library."
        },
        "toolchains": [
            "Arduino IDE",
            "Arduino CLI",
            "PlatformIO",
            "ESP-IDF",
            "MicroPython"
        ],
        "verified": {
            "by": null,
            "date": null,
            "os": null,
            "reviewed_by": null,
            "evidence_url": null
        }
    }
}
