{
    "key": "esp32-s3-devkitc-1",
    "kind": "board",
    "revision": 1,
    "status": "draft",
    "source": "authored",
    "platform": {
        "name": "ESP32-S3-DevKitC-1",
        "description": "Dual core ESP32-S3 with vector instructions for machine learning, native USB and BLE 5. The most capable Espressif part for on-device inference.",
        "board_type": "Microcontroller",
        "manufacturer": "Espressif",
        "model_number": "ESP32-S3-DevKitC-1",
        "datasheet_url": "https://docs.espressif.com/projects/esp-idf/en/latest/esp32s3/hw-reference/esp32s3/user-guide-devkitc-1.html",
        "cpu": "Xtensa dual-core LX7 @ 240MHz",
        "ram": "512KB SRAM plus 8MB PSRAM",
        "storage": "8MB Flash",
        "operating_voltage": "3.3V",
        "gpio_pins": 45,
        "pwm_channels": 8,
        "adc_channels": 20,
        "dac_channels": 0,
        "dimensions_mm": null,
        "weight_g": null,
        "has_npu": false,
        "has_gpu": false,
        "has_tpu": false,
        "operating_systems": [
            {
                "name": "ESP-IDF"
            },
            {
                "name": "Arduino Core"
            },
            {
                "name": "MicroPython"
            }
        ],
        "communication_chips": [
            {
                "chip_model": "ESP32-S3",
                "protocol": "Wi-Fi",
                "standard": "802.11b/g/n"
            },
            {
                "chip_model": "ESP32-S3",
                "protocol": "Bluetooth",
                "standard": "5.0 LE"
            }
        ],
        "serial_protocols": [
            {
                "protocol": "I2C",
                "count": 2
            },
            {
                "protocol": "SPI",
                "count": 4
            },
            {
                "protocol": "UART",
                "count": 3
            },
            {
                "protocol": "I2S",
                "count": 2
            }
        ],
        "interfaces": [
            {
                "type": "USB-C",
                "count": 2
            },
            {
                "type": "2.54mm header",
                "count": 2
            }
        ],
        "power": [
            {
                "source": "USB",
                "voltage_min": 5,
                "voltage_max": 5
            },
            {
                "source": "5V pin",
                "voltage_min": 5,
                "voltage_max": 5
            },
            {
                "source": "3V3 pin",
                "voltage_min": 3.3,
                "voltage_max": 3.3
            }
        ]
    },
    "harness": {
        "provisioning_model": "micropython",
        "supported_provisioning_models": [
            "micropython",
            "arduino-sketch",
            "vendor-firmware"
        ],
        "component_attachment": "gpio-header",
        "flash": {
            "method": "usb-native",
            "tool": "esptool.py",
            "port_hint": "/dev/ttyACM0",
            "baud": 921600,
            "notes": "The SoC exposes USB Serial/JTAG directly, so no bridge chip is involved. A firmware that reconfigures those pins loses the port until the board is put back into download mode by holding BOOT while tapping RESET."
        },
        "transport": {
            "network": [
                "wifi",
                "bluetooth"
            ],
            "mqtt_client": "umqtt.simple",
            "tls": true,
            "ota": true,
            "notes": "Connects to the broker directly over Wi-Fi. TLS works but the handshake is the largest memory spike in a typical device program, so size the heap around it rather than around steady state."
        },
        "runtime": {
            "os_family": null,
            "python3": true,
            "package_manager": "mip",
            "service_manager": null
        },
        "gpio": {
            "library": "machine",
            "pin_scheme": "gpio",
            "notes": "Almost every pin is routable to almost any peripheral through the GPIO matrix, so a driver binds to a pin number chosen at deploy time rather than to a fixed function. The strapping pins and the pins bonded to on-package flash are the exceptions and must not be used."
        },
        "probe": {
            "model_file": null,
            "overlay_file": null,
            "commands": [
                "import sys; print(sys.implementation)",
                "import os; print(os.uname())",
                "import machine; print(machine.freq())",
                "import gc; gc.collect(); print(gc.mem_free())",
                "from machine import I2C, Pin; print(I2C(0).scan())"
            ]
        },
        "local_inference": {
            "viable": true,
            "accelerator": "dsp",
            "usable_memory_gb": null,
            "llm": {
                "viable": false,
                "max_params_b": null,
                "max_model_size_gb": null,
                "quantisation": [],
                "runtimes": [],
                "notes": "Kilobytes of RAM. A general language model does not run here and never will. Send the reading to something that can."
            },
            "tinyml": {
                "viable": true,
                "frameworks": [
                    "ESP-DL",
                    "TensorFlow Lite Micro",
                    "Edge Impulse"
                ],
                "notes": "Vector extensions give roughly an order of magnitude over the original ESP32 on quantised convolutions. With 8MB PSRAM a small image classifier is genuinely practical."
            },
            "notes": "Pick this one when the device has to decide something itself rather than ship every reading to the platform."
        },
        "toolchains": [
            "MicroPython",
            "ESP-IDF",
            "Arduino IDE",
            "Arduino CLI",
            "PlatformIO"
        ],
        "verified": {
            "by": null,
            "date": null,
            "os": null,
            "reviewed_by": null,
            "evidence_url": null
        }
    }
}
