{
    "key": "esp32-p4-function-ev-board",
    "kind": "board",
    "revision": 1,
    "status": "draft",
    "source": "authored",
    "platform": {
        "name": "ESP32-P4-Function-EV-Board",
        "description": "Dual core 400MHz RISC-V with MIPI camera and display interfaces. No radio on the P4 itself; the board carries an ESP32-C6 for wireless.",
        "board_type": "Microcontroller",
        "manufacturer": "Espressif",
        "model_number": "ESP32-P4-Function-EV-Board",
        "datasheet_url": "https://docs.espressif.com/projects/esp-idf/en/latest/esp32p4/hw-reference/esp32p4/user-guide-esp32-p4-function-ev-board.html",
        "cpu": "RISC-V dual-core 32-bit @ 400MHz",
        "ram": "768KB on-chip SRAM plus 32MB PSRAM",
        "storage": "16MB Flash",
        "operating_voltage": "3.3V",
        "gpio_pins": 55,
        "pwm_channels": 8,
        "adc_channels": 8,
        "dac_channels": 0,
        "dimensions_mm": null,
        "weight_g": null,
        "has_npu": false,
        "has_gpu": false,
        "has_tpu": false,
        "operating_systems": [
            {
                "name": "ESP-IDF"
            },
            {
                "name": "Arduino Core"
            }
        ],
        "communication_chips": [
            {
                "chip_model": "ESP32-C6",
                "protocol": "Wi-Fi",
                "standard": "802.11ax Wi-Fi 6 through the on-board co-processor"
            },
            {
                "chip_model": "ESP32-C6",
                "protocol": "Bluetooth",
                "standard": "5.3 LE through the on-board co-processor"
            }
        ],
        "serial_protocols": [
            {
                "protocol": "I2C",
                "count": 3
            },
            {
                "protocol": "SPI",
                "count": 3
            },
            {
                "protocol": "UART",
                "count": 5
            },
            {
                "protocol": "I2S",
                "count": 3
            }
        ],
        "interfaces": [
            {
                "type": "USB-C",
                "count": 2
            },
            {
                "type": "MIPI-CSI camera",
                "count": 1
            },
            {
                "type": "MIPI-DSI display",
                "count": 1
            },
            {
                "type": "microSD",
                "count": 1
            },
            {
                "type": "2.54mm header",
                "count": 2
            }
        ],
        "power": [
            {
                "source": "USB",
                "voltage_min": 5,
                "voltage_max": 5
            },
            {
                "source": "5V pin",
                "voltage_min": 5,
                "voltage_max": 5
            },
            {
                "source": "3V3 pin",
                "voltage_min": 3.3,
                "voltage_max": 3.3
            }
        ]
    },
    "harness": {
        "provisioning_model": "arduino-sketch",
        "supported_provisioning_models": [
            "arduino-sketch",
            "vendor-firmware"
        ],
        "component_attachment": "gpio-header",
        "flash": {
            "method": "usb-native",
            "tool": "esptool.py",
            "port_hint": "/dev/ttyACM0",
            "baud": 921600,
            "notes": "The SoC exposes USB Serial/JTAG directly, so no bridge chip is involved. A firmware that reconfigures those pins loses the port until the board is put back into download mode by holding BOOT while tapping RESET."
        },
        "transport": {
            "network": [
                "wifi",
                "bluetooth"
            ],
            "mqtt_client": null,
            "tls": true,
            "ota": true,
            "notes": "Wi-Fi is provided by an on-board ESP32-C6 reached over ESP-Hosted, not by the P4. That co-processor firmware is a separate build artefact and a separate thing to keep updated."
        },
        "runtime": {
            "os_family": null,
            "python3": false,
            "package_manager": null,
            "service_manager": null
        },
        "gpio": {
            "library": null,
            "pin_scheme": "gpio",
            "notes": "Almost every pin is routable to almost any peripheral through the GPIO matrix, so a driver binds to a pin number chosen at deploy time rather than to a fixed function. The strapping pins and the pins bonded to on-package flash are the exceptions and must not be used."
        },
        "probe": {
            "model_file": null,
            "overlay_file": null,
            "commands": [
                "arduino-cli board list",
                "arduino-cli board details --fqbn <fqbn>"
            ]
        },
        "local_inference": {
            "viable": true,
            "accelerator": "dsp",
            "usable_memory_gb": null,
            "llm": {
                "viable": false,
                "max_params_b": null,
                "max_model_size_gb": null,
                "quantisation": [],
                "runtimes": [],
                "notes": "Kilobytes of RAM. A general language model does not run here and never will. Send the reading to something that can."
            },
            "tinyml": {
                "viable": true,
                "frameworks": [
                    "ESP-DL",
                    "TensorFlow Lite Micro"
                ],
                "notes": "32MB of PSRAM and a camera interface put real image models within reach, by a wide margin the most capable microcontroller in this registry."
            },
            "notes": "The P4 has no radio of its own. Wireless comes from a separate ESP32-C6 over ESP-Hosted, so networking is a two-chip arrangement and firmware has to be built for both."
        },
        "toolchains": [
            "ESP-IDF",
            "Arduino IDE",
            "Arduino CLI",
            "PlatformIO"
        ],
        "verified": {
            "by": null,
            "date": null,
            "os": null,
            "reviewed_by": null,
            "evidence_url": null
        }
    }
}
