{
    "key": "arduino-uno-q-4gb",
    "kind": "board",
    "revision": 1,
    "status": "draft",
    "source": "platform-seed",
    "platform": {
        "name": "Arduino UNO Q 4GB",
        "description": "Hybrid Qualcomm MPU + STM32 MCU board.",
        "board_type": "Single Board Computer / Microcontroller Hybrid",
        "manufacturer": "Arduino",
        "model_number": "ABX00173",
        "datasheet_url": null,
        "cpu": "Qualcomm QRB2210 + STM32U585",
        "ram": "4GB LPDDR4X",
        "storage": "32GB eMMC",
        "operating_voltage": "3.3V",
        "gpio_pins": 12,
        "pwm_channels": 4,
        "adc_channels": 4,
        "dac_channels": 1,
        "dimensions_mm": "68.6 x 53.4",
        "weight_g": 40,
        "has_npu": true,
        "has_gpu": true,
        "has_tpu": false,
        "operating_systems": [
            {
                "name": "Debian Linux"
            },
            {
                "name": "Zephyr OS"
            }
        ],
        "communication_chips": [
            {
                "chip_model": "Qualcomm integrated",
                "protocol": "Wi-Fi",
                "standard": "802.11ac"
            },
            {
                "chip_model": "Qualcomm integrated",
                "protocol": "Bluetooth",
                "standard": "5.1"
            }
        ],
        "serial_protocols": [
            {
                "protocol": "I2C",
                "count": 1
            },
            {
                "protocol": "SPI",
                "count": 1
            },
            {
                "protocol": "UART",
                "count": 1
            }
        ],
        "interfaces": [
            {
                "type": "USB-C",
                "count": 1
            },
            {
                "type": "CSI",
                "count": 2
            },
            {
                "type": "DSI",
                "count": 1
            }
        ],
        "power": [
            {
                "source": "USB-C",
                "voltage_min": 5,
                "voltage_max": 5,
                "current_max_ma": 3000
            }
        ]
    },
    "harness": {
        "provisioning_model": "linux-agent",
        "supported_provisioning_models": [
            "linux-agent",
            "arduino-sketch"
        ],
        "component_attachment": "gpio-header",
        "flash": {
            "method": "emmc",
            "tool": "Arduino App Lab",
            "port_hint": "/dev/ttyACM0",
            "baud": null,
            "notes": "Debian is pre-installed on eMMC, so the Linux side is provisioned over the network like any other single board computer. The STM32U585 is flashed separately over USB when a sketch is used."
        },
        "transport": {
            "network": [
                "wifi",
                "bluetooth"
            ],
            "mqtt_client": "paho-mqtt",
            "tls": true,
            "ota": true,
            "notes": "The Linux side owns the network connection. A sketch on the STM32 reaches the broker through the Linux side, not directly."
        },
        "runtime": {
            "os_family": "debian",
            "python3": true,
            "package_manager": "apt",
            "service_manager": "systemd"
        },
        "gpio": {
            "library": null,
            "pin_scheme": null,
            "notes": "Two processors on one board. Debian runs on the QRB2210 application processor; the UNO headers are wired to the STM32U585 microcontroller, not to the QRB2210. Linux reaches header pins through the Arduino Bridge to the STM32 rather than through a local gpiochip, so a driver written against libgpiod pin numbers does not transfer unchanged. The exact bridge API and pin numbering are unconfirmed and must be established on hardware before any pin-based driver is marked verified."
        },
        "probe": {
            "model_file": "/proc/device-tree/model",
            "overlay_file": null,
            "commands": [
                "cat /proc/device-tree/model",
                "uname -m",
                "ls /sys/bus/iio/devices/*/name",
                "ls /sys/class/hwmon/*/name",
                "ls /sys/bus/w1/devices/",
                "i2cdetect -y 1",
                "lsusb",
                "ls /dev/serial/by-id/",
                "gpiodetect",
                "gpioinfo"
            ]
        },
        "local_inference": {
            "viable": true,
            "accelerator": "npu",
            "usable_memory_gb": 4,
            "llm": {
                "viable": true,
                "max_params_b": 3,
                "max_model_size_gb": 2,
                "quantisation": [
                    "q4_k_m",
                    "q4_0"
                ],
                "runtimes": [
                    "llama.cpp"
                ],
                "notes": "4GB shared between the OS and the model. A 1B to 3B model at 4-bit is the realistic ceiling. Whether the Hexagon NPU can be used for language models through the Qualcomm stack on this board is unconfirmed."
            },
            "tinyml": {
                "viable": true,
                "frameworks": [
                    "TensorFlow Lite",
                    "ONNX Runtime",
                    "Qualcomm QNN"
                ],
                "notes": "The QRB2210 carries a Hexagon DSP and Adreno GPU. Access through QNN on the shipped Debian image is unconfirmed."
            },
            "notes": "The most capable board here for its size and price, and the only one that is both a Linux host and a microcontroller in one package."
        },
        "toolchains": [
            "Arduino App Lab",
            "Arduino CLI",
            "PlatformIO",
            "Docker"
        ],
        "verified": {
            "by": null,
            "date": null,
            "os": null,
            "reviewed_by": null,
            "evidence_url": null
        }
    }
}
