{
    "key": "esp32-cam",
    "kind": "board",
    "revision": 1,
    "status": "draft",
    "source": "authored",
    "platform": {
        "name": "ESP32-CAM",
        "description": "ESP32 with an OV2640 2MP camera and a microSD slot on a module the size of a postage stamp. Cheap, ubiquitous and awkward to flash.",
        "board_type": "Microcontroller",
        "manufacturer": "AI-Thinker",
        "model_number": "ESP32-CAM",
        "datasheet_url": null,
        "cpu": "Xtensa dual-core LX6 @ 240MHz",
        "ram": "520KB SRAM plus 4MB PSRAM",
        "storage": "4MB Flash",
        "operating_voltage": "3.3V",
        "gpio_pins": 9,
        "pwm_channels": 16,
        "adc_channels": 4,
        "dac_channels": 0,
        "dimensions_mm": null,
        "weight_g": null,
        "has_npu": false,
        "has_gpu": false,
        "has_tpu": false,
        "operating_systems": [
            {
                "name": "ESP-IDF"
            },
            {
                "name": "Arduino Core"
            },
            {
                "name": "MicroPython"
            }
        ],
        "communication_chips": [
            {
                "chip_model": "ESP32-S",
                "protocol": "Wi-Fi",
                "standard": "802.11b/g/n"
            },
            {
                "chip_model": "ESP32-S",
                "protocol": "Bluetooth",
                "standard": "4.2 BR/EDR and BLE"
            }
        ],
        "serial_protocols": [
            {
                "protocol": "I2C",
                "count": 1
            },
            {
                "protocol": "SPI",
                "count": 1
            },
            {
                "protocol": "UART",
                "count": 2
            }
        ],
        "interfaces": [
            {
                "type": "OV2640 camera",
                "count": 1
            },
            {
                "type": "microSD",
                "count": 1
            },
            {
                "type": "2.54mm header",
                "count": 2
            }
        ],
        "power": [
            {
                "source": "USB",
                "voltage_min": 5,
                "voltage_max": 5
            },
            {
                "source": "5V pin",
                "voltage_min": 5,
                "voltage_max": 5
            },
            {
                "source": "3V3 pin",
                "voltage_min": 3.3,
                "voltage_max": 3.3
            }
        ]
    },
    "harness": {
        "provisioning_model": "micropython",
        "supported_provisioning_models": [
            "micropython",
            "arduino-sketch",
            "vendor-firmware"
        ],
        "component_attachment": "gpio-header",
        "flash": {
            "method": "usb-serial",
            "tool": "esptool.py",
            "port_hint": "/dev/ttyUSB0",
            "baud": 115200,
            "notes": "There is no USB connector on the board. Flashing needs an external USB to TTL adapter wired to U0R and U0T, with GPIO0 shorted to ground to enter the bootloader and the short removed before running. Powering it from a 3.3V adapter pin browns out during Wi-Fi transmit; use 5V. This is the single most common reason an ESP32-CAM appears dead."
        },
        "transport": {
            "network": [
                "wifi",
                "bluetooth"
            ],
            "mqtt_client": "umqtt.simple",
            "tls": true,
            "ota": true,
            "notes": "Connects to the broker directly over Wi-Fi. TLS works but the handshake is the largest memory spike in a typical device program, so size the heap around it rather than around steady state."
        },
        "runtime": {
            "os_family": null,
            "python3": true,
            "package_manager": "mip",
            "service_manager": null
        },
        "gpio": {
            "library": "machine",
            "pin_scheme": "gpio",
            "notes": "Almost every pin is routable to almost any peripheral through the GPIO matrix, so a driver binds to a pin number chosen at deploy time rather than to a fixed function. The strapping pins and the pins bonded to on-package flash are the exceptions and must not be used."
        },
        "probe": {
            "model_file": null,
            "overlay_file": null,
            "commands": [
                "import sys; print(sys.implementation)",
                "import os; print(os.uname())",
                "import machine; print(machine.freq())",
                "import gc; gc.collect(); print(gc.mem_free())",
                "from machine import I2C, Pin; print(I2C(0).scan())"
            ]
        },
        "local_inference": {
            "viable": true,
            "accelerator": null,
            "usable_memory_gb": null,
            "llm": {
                "viable": false,
                "max_params_b": null,
                "max_model_size_gb": null,
                "quantisation": [],
                "runtimes": [],
                "notes": "Kilobytes of RAM. A general language model does not run here and never will. Send the reading to something that can."
            },
            "tinyml": {
                "viable": true,
                "frameworks": [
                    "ESP-DL",
                    "TensorFlow Lite Micro",
                    "Edge Impulse"
                ],
                "notes": "4MB PSRAM holds a camera frame buffer, which is what makes vision possible at all on an original ESP32."
            },
            "notes": "Most of the GPIO is consumed by the camera and the SD card. Count the free pins against the driver's requirements before committing to this board."
        },
        "toolchains": [
            "MicroPython",
            "ESP-IDF",
            "Arduino IDE",
            "Arduino CLI",
            "PlatformIO"
        ],
        "verified": {
            "by": null,
            "date": null,
            "os": null,
            "reviewed_by": null,
            "evidence_url": null
        }
    }
}
