{
    "key": "seeed-xiao-esp32c3",
    "kind": "board",
    "revision": 1,
    "status": "draft",
    "source": "authored",
    "platform": {
        "name": "Seeed XIAO ESP32C3",
        "description": "ESP32-C3 on a thumbnail-sized board with a U.FL connector for an external antenna and on-board battery charging.",
        "board_type": "Microcontroller",
        "manufacturer": "Seeed Studio",
        "model_number": "XIAO ESP32C3",
        "datasheet_url": "https://wiki.seeedstudio.com/XIAO_ESP32C3_Getting_Started/",
        "cpu": "RISC-V single-core 32-bit @ 160MHz",
        "ram": "400KB SRAM",
        "storage": "4MB Flash",
        "operating_voltage": "3.3V",
        "gpio_pins": 11,
        "pwm_channels": 6,
        "adc_channels": 4,
        "dac_channels": 0,
        "dimensions_mm": "21 x 17.5",
        "weight_g": 2,
        "has_npu": false,
        "has_gpu": false,
        "has_tpu": false,
        "operating_systems": [
            {
                "name": "ESP-IDF"
            },
            {
                "name": "Arduino Core"
            },
            {
                "name": "MicroPython"
            }
        ],
        "communication_chips": [
            {
                "chip_model": "ESP32-C3",
                "protocol": "Wi-Fi",
                "standard": "802.11b/g/n"
            },
            {
                "chip_model": "ESP32-C3",
                "protocol": "Bluetooth",
                "standard": "5.0 LE"
            }
        ],
        "serial_protocols": [
            {
                "protocol": "I2C",
                "count": 1
            },
            {
                "protocol": "SPI",
                "count": 1
            },
            {
                "protocol": "UART",
                "count": 1
            }
        ],
        "interfaces": [
            {
                "type": "USB-C",
                "count": 1
            },
            {
                "type": "U.FL antenna",
                "count": 1
            },
            {
                "type": "Battery pads",
                "count": 1
            }
        ],
        "power": [
            {
                "source": "USB",
                "voltage_min": 5,
                "voltage_max": 5
            },
            {
                "source": "5V pin",
                "voltage_min": 5,
                "voltage_max": 5
            },
            {
                "source": "3V3 pin",
                "voltage_min": 3.3,
                "voltage_max": 3.3
            }
        ]
    },
    "harness": {
        "provisioning_model": "micropython",
        "supported_provisioning_models": [
            "micropython",
            "arduino-sketch",
            "vendor-firmware"
        ],
        "component_attachment": "gpio-header",
        "flash": {
            "method": "usb-native",
            "tool": "esptool.py",
            "port_hint": "/dev/ttyACM0",
            "baud": 921600,
            "notes": "The SoC exposes USB Serial/JTAG directly, so no bridge chip is involved. A firmware that reconfigures those pins loses the port until the board is put back into download mode by holding BOOT while tapping RESET."
        },
        "transport": {
            "network": [
                "wifi",
                "bluetooth"
            ],
            "mqtt_client": "umqtt.simple",
            "tls": true,
            "ota": true,
            "notes": "Connects to the broker directly over Wi-Fi. TLS works but the handshake is the largest memory spike in a typical device program, so size the heap around it rather than around steady state."
        },
        "runtime": {
            "os_family": null,
            "python3": true,
            "package_manager": "mip",
            "service_manager": null
        },
        "gpio": {
            "library": "machine",
            "pin_scheme": "gpio",
            "notes": "Almost every pin is routable to almost any peripheral through the GPIO matrix, so a driver binds to a pin number chosen at deploy time rather than to a fixed function. The strapping pins and the pins bonded to on-package flash are the exceptions and must not be used."
        },
        "probe": {
            "model_file": null,
            "overlay_file": null,
            "commands": [
                "import sys; print(sys.implementation)",
                "import os; print(os.uname())",
                "import machine; print(machine.freq())",
                "import gc; gc.collect(); print(gc.mem_free())",
                "from machine import I2C, Pin; print(I2C(0).scan())"
            ]
        },
        "local_inference": {
            "viable": true,
            "accelerator": null,
            "usable_memory_gb": null,
            "llm": {
                "viable": false,
                "max_params_b": null,
                "max_model_size_gb": null,
                "quantisation": [],
                "runtimes": [],
                "notes": "Kilobytes of RAM. A general language model does not run here and never will. Send the reading to something that can."
            },
            "tinyml": {
                "viable": true,
                "frameworks": [
                    "TensorFlow Lite Micro"
                ],
                "notes": "C3 limits apply. Very small models only."
            },
            "notes": "The external antenna connector is the reason to pick this over a bare C3 devkit. Range through a wall is not comparable."
        },
        "toolchains": [
            "MicroPython",
            "ESP-IDF",
            "Arduino IDE",
            "Arduino CLI",
            "PlatformIO"
        ],
        "verified": {
            "by": null,
            "date": null,
            "os": null,
            "reviewed_by": null,
            "evidence_url": null
        }
    }
}
